{
  "$schema": "https://json-schema.org/draft/2020-12/schema",
  "$id": "anarchyball://schemas/level_spec_v0",
  "title": "Anarchyball LevelSpec v0",
  "type": "object",
  "additionalProperties": false,
  "required": [
    "schema_version",
    "level_id",
    "player_spawn",
    "exit",
    "bounds",
    "movement_profile_path",
    "class_loadout_id",
    "ideology_rule_ids",
    "platforms",
    "encounters",
    "resources",
    "sections"
  ],
  "properties": {
    "schema_version": {
      "const": 0
    },
    "level_id": {
      "$ref": "#/$defs/stable_id"
    },
    "display_name": {
      "type": "string"
    },
    "player_spawn": {
      "$ref": "#/$defs/point"
    },
    "exit": {
      "$ref": "#/$defs/point"
    },
    "bounds": {
      "type": "object",
      "additionalProperties": false,
      "required": [
        "width",
        "height"
      ],
      "properties": {
        "width": {
          "type": "number",
          "exclusiveMinimum": 0
        },
        "height": {
          "type": "number",
          "exclusiveMinimum": 0
        }
      }
    },
    "movement_profile_path": {
      "type": "string",
      "pattern": "^res://.+\\.tres$"
    },
    "class_loadout_id": {
      "$ref": "#/$defs/stable_id"
    },
    "ideology_rule_ids": {
      "type": "array",
      "maxItems": 1,
      "items": {
        "$ref": "#/$defs/stable_id"
      }
    },
    "platforms": {
      "type": "array",
      "minItems": 1,
      "items": {
        "$ref": "#/$defs/platform"
      }
    },
    "encounters": {
      "type": "array",
      "items": {
        "$ref": "#/$defs/encounter"
      }
    },
    "resources": {
      "type": "array",
      "items": {
        "$ref": "#/$defs/resource"
      }
    },
    "sections": {
      "type": "array",
      "minItems": 1,
      "items": {
        "$ref": "#/$defs/section"
      }
    },
    "checkpoints": {
      "type": "array",
      "items": {
        "$ref": "#/$defs/checkpoint"
      }
    },
    "gates": {
      "type": "array",
      "items": {
        "$ref": "#/$defs/gate"
      }
    },
    "rule_objects": {
      "type": "array",
      "items": {
        "$ref": "#/$defs/rule_object"
      }
    },
    "contracts": {
      "type": "array",
      "items": {
        "$ref": "#/$defs/contract"
      }
    },
    "actors": {
      "type": "array",
      "items": {
        "$ref": "#/$defs/actor"
      }
    },
    "slice": {
      "$ref": "#/$defs/slice"
    }
  },
  "$defs": {
    "stable_id": {
      "type": "string",
      "pattern": "^[a-z][a-z0-9]*(?:_[a-z0-9]+)*$"
    },
    "point": {
      "type": "object",
      "additionalProperties": false,
      "required": [
        "x",
        "y"
      ],
      "properties": {
        "x": {
          "type": "number"
        },
        "y": {
          "type": "number"
        }
      }
    },
    "platform": {
      "type": "object",
      "additionalProperties": false,
      "required": [
        "id",
        "x",
        "y",
        "width",
        "height",
        "required",
        "route_tags"
      ],
      "properties": {
        "id": {
          "$ref": "#/$defs/stable_id"
        },
        "x": {
          "type": "number"
        },
        "y": {
          "type": "number"
        },
        "width": {
          "type": "number",
          "exclusiveMinimum": 0
        },
        "height": {
          "type": "number",
          "exclusiveMinimum": 0
        },
        "required": {
          "type": "boolean"
        },
        "route_tags": {
          "type": "array",
          "items": {
            "$ref": "#/$defs/stable_id"
          }
        },
        "art_style": {
          "enum": [
            "road",
            "column_supported"
          ]
        },
        "motion_distance_y": {
          "type": "number"
        },
        "motion_speed": {
          "type": "number",
          "exclusiveMinimum": 0
        }
      }
    },
    "encounter": {
      "type": "object",
      "additionalProperties": false,
      "required": [
        "id",
        "definition_id",
        "x",
        "y"
      ],
      "properties": {
        "id": {
          "$ref": "#/$defs/stable_id"
        },
        "definition_id": {
          "$ref": "#/$defs/stable_id"
        },
        "x": {
          "type": "number"
        },
        "y": {
          "type": "number"
        },
        "rule_object_ids": {
          "type": "array",
          "items": {
            "$ref": "#/$defs/stable_id"
          }
        },
        "resolution_gate_id": {
          "$ref": "#/$defs/stable_id"
        },
        "required_for_completion": {
          "type": "boolean",
          "default": false
        },
        "enemy_count": {
          "type": "integer",
          "minimum": 1
        },
        "enemy_positions": {
          "type": "array",
          "minItems": 1,
          "items": {
            "$ref": "#/$defs/point"
          }
        },
        "resource_ids": {
          "type": "array",
          "items": {
            "$ref": "#/$defs/stable_id"
          }
        },
        "resolution_platform_ids": {
          "type": "array",
          "items": {
            "$ref": "#/$defs/stable_id"
          }
        }
      }
    },
    "resource": {
      "type": "object",
      "additionalProperties": false,
      "required": [
        "id",
        "kind",
        "x",
        "y",
        "ownership"
      ],
      "properties": {
        "id": {
          "$ref": "#/$defs/stable_id"
        },
        "kind": {
          "$ref": "#/$defs/stable_id"
        },
        "x": {
          "type": "number"
        },
        "y": {
          "type": "number"
        },
        "ownership": {
          "type": "string"
        },
        "effect_id": {
          "enum": [
            "health_restore"
          ]
        },
        "effect_amount": {
          "type": "number",
          "exclusiveMinimum": 0
        }
      }
    },
    "section": {
      "type": "object",
      "additionalProperties": false,
      "required": [
        "id",
        "from_x",
        "to_x"
      ],
      "properties": {
        "id": {
          "$ref": "#/$defs/stable_id"
        },
        "from_x": {
          "type": "number"
        },
        "to_x": {
          "type": "number"
        }
      }
    },
    "checkpoint": {
      "type": "object",
      "additionalProperties": false,
      "required": [
        "id",
        "x",
        "y",
        "respawn_x",
        "respawn_y"
      ],
      "properties": {
        "id": {
          "$ref": "#/$defs/stable_id"
        },
        "x": {
          "type": "number"
        },
        "y": {
          "type": "number"
        },
        "respawn_x": {
          "type": "number"
        },
        "respawn_y": {
          "type": "number"
        }
      }
    },
    "gate": {
      "type": "object",
      "additionalProperties": false,
      "required": [
        "id",
        "x",
        "y",
        "width",
        "height",
        "required_tag",
        "label"
      ],
      "properties": {
        "id": {
          "$ref": "#/$defs/stable_id"
        },
        "x": {
          "type": "number"
        },
        "y": {
          "type": "number"
        },
        "width": {
          "type": "number",
          "exclusiveMinimum": 0
        },
        "height": {
          "type": "number",
          "exclusiveMinimum": 0
        },
        "required_tag": {
          "$ref": "#/$defs/stable_id"
        },
        "key_resource_id": {
          "$ref": "#/$defs/stable_id"
        },
        "label": {
          "type": "string"
        }
      }
    },
    "rule_object": {
      "type": "object",
      "additionalProperties": false,
      "required": [
        "id",
        "hook_id",
        "x",
        "y",
        "initial_state",
        "target_platform_ids",
        "interaction_tag"
      ],
      "properties": {
        "id": {
          "$ref": "#/$defs/stable_id"
        },
        "hook_id": {
          "$ref": "#/$defs/stable_id"
        },
        "x": {
          "type": "number"
        },
        "y": {
          "type": "number"
        },
        "initial_state": {
          "enum": [
            "inactive",
            "available",
            "occupied",
            "disabled",
            "abandoned",
            "disputed"
          ]
        },
        "target_platform_ids": {
          "type": "array",
          "minItems": 0,
          "items": {
            "$ref": "#/$defs/stable_id"
          }
        },
        "targets_enabled_before_interaction": {
          "type": "boolean"
        },
        "interaction_tag": {
          "$ref": "#/$defs/stable_id"
        },
        "requires": {
          "type": "array",
          "items": {
            "$ref": "#/$defs/stable_id"
          }
        },
        "label": {
          "type": "string"
        },
        "hint": {
          "type": "string"
        },
        "visual_kind": {
          "enum": [
            "machine",
            "signal"
          ]
        },
        "call_only": {
          "type": "boolean"
        },
        "service_gate_id": {
          "type": "string",
          "pattern": "^[a-z][a-z0-9_]*$"
        }
      }
    },
    "contract": {
      "type": "object",
      "additionalProperties": false,
      "required": [
        "id",
        "definition_id",
        "x",
        "y",
        "acceptance_gate_id",
        "resolution_gate_id",
        "encounter_id",
        "performance_x",
        "resolution_x",
        "resolution_y",
        "counterparty_escape_x"
      ],
      "properties": {
        "id": {
          "$ref": "#/$defs/stable_id"
        },
        "definition_id": {
          "$ref": "#/$defs/stable_id"
        },
        "x": {
          "type": "number"
        },
        "y": {
          "type": "number"
        },
        "acceptance_gate_id": {
          "$ref": "#/$defs/stable_id"
        },
        "resolution_gate_id": {
          "$ref": "#/$defs/stable_id"
        },
        "encounter_id": {
          "$ref": "#/$defs/stable_id"
        },
        "performance_x": {
          "type": "number"
        },
        "resolution_x": {
          "type": "number"
        },
        "resolution_y": {
          "type": "number"
        },
        "counterparty_escape_x": {
          "type": "number"
        }
      }
    },
    "actor": {
      "type": "object",
      "additionalProperties": false,
      "required": [
        "id",
        "archetype_id",
        "x",
        "y"
      ],
      "properties": {
        "id": {
          "$ref": "#/$defs/stable_id"
        },
        "archetype_id": {
          "$ref": "#/$defs/stable_id"
        },
        "x": {
          "type": "number"
        },
        "y": {
          "type": "number"
        }
      }
    },
    "slice": {
      "type": "object",
      "additionalProperties": false,
      "required": [
        "title",
        "objective",
        "intro",
        "completion"
      ],
      "properties": {
        "title": {
          "type": "string"
        },
        "objective": {
          "type": "string"
        },
        "intro": {
          "type": "string"
        },
        "completion": {
          "type": "string"
        },
        "briefing_cards": {
          "type": "array",
          "items": {
            "type": "object",
            "additionalProperties": false,
            "required": [
              "title",
              "body"
            ],
            "properties": {
              "title": {
                "type": "string"
              },
              "body": {
                "type": "string"
              },
              "image_path": {
                "type": "string",
                "pattern": "^res://.+\\.png$"
              },
              "image_columns": {
                "type": "integer",
                "minimum": 1
              },
              "image_frame": {
                "type": "integer",
                "minimum": 0
              },
              "image_rows": {
                "type": "integer",
                "minimum": 1,
                "maximum": 16
              }
            }
          }
        }
      }
    }
  }
}
