{
  "schema_version": 0,
  "level_id": "phase6_occupancy_preview",
  "display_name": "Phase 6 · Occupancy and Use Preview",
  "slice": {
    "title": "OCCUPANCY AND USE · RULE PREVIEW",
    "objective": "Operate the disputed machine before detention commits, or defend yourself after the enforcer becomes an aggressor",
    "intro": "An unused machine grants no automatic title. The first machine teaches occupation safely. At the disputed machine, operate it during the visible detention warning or wait until aggression is committed before defending yourself. The ground remains a baseline bypass.",
    "completion": "The machinery changed through present use without turning a disagreement into combat. This remains draft content until human playtest approval."
  },
  "player_spawn": {"x": 100, "y": 596},
  "exit": {"x": 1710, "y": 596},
  "bounds": {"width": 1800, "height": 720},
  "movement_profile_path": "res://data/player/default_movement_profile.tres",
  "class_loadout_id": "class_contractor",
  "ideology_rule_ids": ["rule_occupancy_and_use"],
  "platforms": [
    {"id": "ground_teach", "x": 0, "y": 620, "width": 850, "height": 100, "required": true, "route_tags": []},
    {"id": "ground_demonstrate", "x": 850, "y": 620, "width": 950, "height": 100, "required": true, "route_tags": []},
    {"id": "platform_safe_machine", "x": 500, "y": 470, "width": 210, "height": 24, "required": false, "route_tags": ["occupy_machine"]},
    {"id": "platform_disputed_machine", "x": 1190, "y": 455, "width": 250, "height": 24, "required": false, "route_tags": ["occupy_machine"]}
  ],
  "encounters": [
    {
      "id": "occupancy_dispute",
      "definition_id": "encounter_occupancy_dispute",
      "x": 1320,
      "y": 570,
      "rule_object_ids": ["machine_disputed_use"]
    }
  ],
  "resources": [],
  "sections": [
    {"id": "section_teach_occupancy", "from_x": 0, "to_x": 850},
    {"id": "section_demonstrate_exclusion", "from_x": 850, "to_x": 1800}
  ],
  "checkpoints": [
    {"id": "checkpoint_between_machines", "x": 860, "y": 560, "respawn_x": 810, "respawn_y": 596}
  ],
  "rule_objects": [
    {
      "id": "machine_safe_use",
      "hook_id": "occupancy_machine",
      "x": 350,
      "y": 560,
      "initial_state": "available",
      "target_platform_ids": ["platform_safe_machine"],
      "interaction_tag": "occupy_machine"
    },
    {
      "id": "machine_disputed_use",
      "hook_id": "occupancy_machine",
      "x": 1040,
      "y": 560,
      "initial_state": "available",
      "target_platform_ids": ["platform_disputed_machine"],
      "interaction_tag": "occupy_machine"
    }
  ]
}
